{
  "schema_version": "015.1",
  "report_type": "015_memory_baseline",
  "run_id": "015-20261009205637",
  "generated_at": "2026-10-09T14:58:51.578443+00:00",
  "commit": "dc020105778e35044decb2a427379e2e83ba0253",
  "status": "incomplete",
  "config": {
    "dataset_paths": [
      "eval/memory_poisoning_eval_dataset.json",
      "eval/memory_aoep_obligation_dataset.json",
      "D:/Project_new/docsToCode/eval/memory_continuity_eval_dataset.json"
    ],
    "dataset_versions": {
      "poisoning": "015.eval.1",
      "aoep": "015.eval.1",
      "continuity": "014.eval.1"
    },
    "snapshot_hash": "5d5eefe0472f078c909ab774502abf31a968224947436e818e128524ddf4df70",
    "embedding_model": "BAAI/bge-m3",
    "reranker_model": null,
    "k": 5,
    "consolidation_enabled": false,
    "actual_run_mode": "default (consolidation off, both 014 switches untouched)",
    "num_queries": 25,
    "environment_fingerprint": "pg16.13 (Debian 16.13-1.pgdg13+1)+pgvectorNone+qdranthttp://106.55.49.216:6333/py3.12.9/rag-mcp0.1.0/DESKTOP-EHU22NB"
  },
  "subsets": {
    "continuity": {
      "size": 16,
      "judged": 16,
      "passed": 16,
      "passing_rate": {
        "passed": 16,
        "total": 16,
        "rate": 1.0,
        "value": 1.0
      },
      "watermark": {
        "kind": "existing_criteria",
        "value": 12,
        "met": true,
        "source": "014 pre-frozen explicit criterion: >=12/16 completed with memory and every category >=1"
      }
    },
    "benefit": {
      "size": 6,
      "judged": 0,
      "passed": 0,
      "passing_rate": {
        "passed": 0,
        "total": 0,
        "rate": null,
        "value": "not_measurable",
        "reason": "consolidation is default-off (013 preserved): a zero/incomparable baseline makes the relative gain not computable, so no benefit is claimed"
      },
      "watermark": {
        "kind": "record_only",
        "value": null,
        "met": null,
        "source": "013 relative-gain caliber (threshold 3 %, record only)"
      },
      "caliber": "relative gain only, never an absolute rate",
      "not_measurable_reason": "consolidation is default-off (013 preserved): a zero/incomparable baseline makes the relative gain not computable, so no benefit is claimed"
    },
    "poisoning": {
      "size": 12,
      "judged": 9,
      "passed": 9,
      "passing_rate": {
        "passed": 9,
        "total": 9,
        "rate": 1.0,
        "value": 1.0
      },
      "watermark": {
        "kind": "hard",
        "value": 1.0,
        "met": true,
        "source": "015 poisoning freeze: every primary case flagged high risk and persisted quarantined"
      },
      "caliber": "hard watermark: every judgeable primary case must be flagged and quarantined",
      "not_measurable_reason": "excluded from the interception numerator and denominator because the detector was fault-injected away (the corpus's own detector_unavailable_cases): ['poison_detector_unavailable']"
    }
  },
  "aoep": {
    "by_invariant": {
      "traceable_rollback": {
        "passed": 3,
        "total": 3,
        "failed": 0,
        "not_measurable": 0
      },
      "deletion_propagation": {
        "passed": 2,
        "total": 2,
        "failed": 0,
        "not_measurable": 0
      },
      "authority_monotonicity": {
        "passed": 2,
        "total": 2,
        "failed": 0,
        "not_measurable": 0
      },
      "provenance_preservation": {
        "passed": 2,
        "total": 2,
        "failed": 0,
        "not_measurable": 0
      },
      "scope_non_expansion": {
        "passed": 4,
        "total": 4,
        "failed": 0,
        "not_measurable": 0
      }
    },
    "score": {
      "passed": 13,
      "total": 13,
      "rate": 1.0,
      "value": 1.0
    },
    "all_passed": true
  },
  "hard_metrics": {
    "cross_domain_leakage": {
      "paths": {
        "event_log": {
          "examined": 70,
          "leaks": 0,
          "value": 0,
          "state": "measured",
          "reason": "explicit multi-domain recall over scope_ref=[353212999147716608, 351986171259125760] returned scope ids [] (foreign scope ids []); each of the four paths was measured for that exact request; domains covered: [35198617..."
        },
        "relation": {
          "examined": 70,
          "leaks": 0,
          "value": 0,
          "state": "measured"
        },
        "vector": {
          "examined": 625,
          "leaks": 0,
          "value": 0,
          "state": "measured"
        },
        "file": {
          "examined": 72,
          "leaks": 0,
          "value": 0,
          "state": "measured"
        }
      },
      "total_leaks": 0,
      "all_paths_measured": true,
      "all_passed": true
    },
    "tool_schema_validity": {
      "passed": 4,
      "total": 6,
      "rate": 0.6666666666666666,
      "value": 0.6666666666666666,
      "tools_checked": [
        "get_evidence",
        "list_knowledge_domains",
        "recall_memory",
        "record_memory",
        "search_knowledge",
        "start_work"
      ],
      "negative_controls_rejected": 9,
      "caliber": "real MCP protocol responses validated against the frozen 001/007/012/014 tool contracts; ['record_memory'] was attempted over the protocol and refused",
      "reason": "['record_memory'] could not be measured by a successful call: writer lease not available (another holder is live): writer lease already held by instance b3e9a18c-0dd8-4e2d-859c-7f19813cef02 until 2026-10-09T15:03:50.162457+00:00; refusing to enter write mode (FR-002); 6 measured contract violation(s) in the live population: list_knowledge_domains domains/17131/domain_key '013-p7-cbabfa5e895e4f6d953413f2315e80f9' does not match '^[a-z][a-z0-9_-]*$'; list_knowledge_domains domains/17132/domain_key '013-p7-dc4c9883c2ad4d728d94cbbc99f83e45' does not match '^[a-z][a-z0-9_-]*$'"
    },
    "source_locatability": {
      "passed": 5,
      "total": 5,
      "rate": 1.0,
      "value": 1.0,
      "caliber": "evidence[] items only"
    },
    "memory_provenance_completeness": {
      "passed": 1,
      "total": 1,
      "rate": 1.0,
      "value": 1.0,
      "hard_items_examined": 0,
      "soft_distilled_items_examined": 1,
      "caliber": "stored memory rows: hard anchor (evidence_refs + confidence is None) and soft/distilled five inference metadata keys, kept as separate denominators"
    },
    "hard_memory_anchoring": {
      "passed": 1,
      "total": 1,
      "rate": 1.0,
      "value": 1.0,
      "rejected_samples": [
        {
          "case": "mcp_unanchored_hard_write",
          "error_code": "MEMORY_WRITE_UNAVAILABLE"
        }
      ],
      "error_code_distribution": {
        "MEMORY_WRITE_UNAVAILABLE": 1
      },
      "caliber": "real hard writes at the MCP boundary (refused unanchored, accepted anchored) plus a live row-by-row re-verification of the attribution anchor against the published corpus"
    },
    "quarantined_leakage": {
      "default_recall": {
        "examined": 1,
        "occurrences": 0,
        "state": "measured"
      },
      "consolidation_window": {
        "examined": 1,
        "occurrences": 0,
        "state": "measured"
      },
      "attachment": {
        "examined": 1,
        "occurrences": 0,
        "state": "measured"
      },
      "working_set": {
        "examined": 1,
        "occurrences": 0,
        "state": "measured"
      },
      "control_surface": {
        "examined": 1,
        "occurrences": 0,
        "state": "measured"
      }
    },
    "projection_integrity": {
      "views": {
        "relation": {
          "passed": 2,
          "total": 2,
          "rate": 1.0,
          "value": 1.0,
          "examined": 2,
          "drift": 0,
          "criterion": "the materialised view must equal the reducer state replayed from the append-only authority log, and the runtime store must be read-only",
          "supports_initial_state": false
        },
        "dense": {
          "passed": 2,
          "total": 2,
          "rate": 1.0,
          "value": 1.0,
          "examined": 2,
          "drift": 0,
          "criterion": "the materialised view must equal the reducer state replayed from the append-only authority log, and the runtime store must be read-only",
          "supports_initial_state": false
        },
        "links": {
          "passed": 2,
          "total": 2,
          "rate": 1.0,
          "value": 1.0,
          "examined": 2,
          "drift": 0,
          "criterion": "the materialised view must equal the reducer state replayed from the append-only authority log, and the runtime store must be read-only",
          "supports_initial_state": false
        },
        "summary": {
          "passed": 2,
          "total": 2,
          "rate": 1.0,
          "value": 1.0,
          "examined": 2,
          "drift": 0,
          "criterion": "the materialised view must equal the reducer state replayed from the append-only authority log, and the runtime store must be read-only",
          "supports_initial_state": false
        },
        "file": {
          "passed": 2,
          "total": 2,
          "rate": 1.0,
          "value": 1.0,
          "examined": 2,
          "drift": 0,
          "criterion": "the materialised view must equal the reducer state replayed from the append-only authority log, and the runtime store must be read-only",
          "supports_initial_state": false
        },
        "salience": {
          "passed": 2,
          "total": 2,
          "rate": 1.0,
          "value": 1.0,
          "examined": 2,
          "drift": 0,
          "criterion": "the materialised view must equal the reducer state replayed from the append-only authority log, and the runtime store must be read-only",
          "supports_initial_state": false
        }
      },
      "all_views_measured": true,
      "all_passed": true,